system_prompt,question
You are an AI assistant that follows instruction extremely well. Help as much as you can.,"Question: Information:  - The Pakistan Armed Forces (""Musallah Afwaj-e-Pakistan"") are the military forces of Pakistan. They are the sixth largest in the world in terms of active military personnel and the largest among Muslim countries. The armed forces comprise three main service branches  Army, Navy, and Air Force  together with a number of paramilitary forces and the Strategic Plans Division Force. Chain of command of the military is organized under the Chairman of Joint Chiefs of Staff Committee (JCSC) alongside chiefs of staff of the army, navy, and air force. All of the branches work together during operations and joint missions under the Joint Staff Headquarters (JS HQ).  - China, officially the People's Republic of China (PRC), is a unitary sovereign state in East Asia. With a population of over 1.381 billion, it is the world's most populous country. The state is governed by the Communist Party of China, and its capital is Beijing. It exercises jurisdiction over 22 provinces, five autonomous regions, four direct-controlled municipalities (Beijing, Tianjin, Shanghai, and Chongqing), and two mostly self-governing special administrative regions (Hong Kong and Macau), and claims sovereignty over Taiwan. The country's major urban areas include Shanghai, Guangzhou, Beijing, Chongqing, Shenzhen, Tianjin and Hong Kong. China is a great power and a major regional power within Asia, and has been characterized as a potential superpower.  - Test cricket is the longest form of the sport of cricket and is considered its highest standard. Test matches are played between national representative teams with ""Test status"", as determined by the International Cricket Council (ICC). The two teams of 11 players play a four-innings match, which may last up to five days (or longer in some historical cases). It is generally considered the most complete examination of teams' playing ability and endurance. The name ""Test"" stems from the long, gruelling match being a ""test"" of the relative strengths of the two sides.  - Jhelum (Urdu) is a city on the right bank of the Jhelum River, in the district of the same name in the north of Punjab province, Pakistan. Jhelum is known for providing a large number of soldiers to the British Army before independence and later to the Pakistan armed forces due to which it is also known as city of soldiers or land of martyrs and warriors. Jhelum is a few miles upstream from the site of the Battle of the Hydaspes between the armies of Alexander of Macedonia and Raja Porus. A city called Bucephala was founded nearby to commemorate the death of Alexander's horse, Bucephalus. Other notable sites nearby include the 16th-century Rohtas Fort, the Tilla Jogian complex of ancient temples, and the 16th-century Grand Trunk Road which passes through the city. According to the 1998 census of Pakistan, the population of Jhelum was 145,647 and in 2012 its population is 188,803. The name of the city is derived from the words Jal (pure water) and Ham (snow), as the river that flows through the river originates in the Himalayas. There are a number of industries in and around Jhelum city, including a tobacco factory, wood, marble, glass and flour mills.  - Pakistan (or ), officially the Islamic Republic of Pakistan, is a federal parliamentary republic in South Asia on crossroads of Central Asia and Western Asia. It is the sixth-most populous country with a population exceeding 200 million people. It is the 36th largest country in the world in terms of area with an area covering . Pakistan has a coastline along the Arabian Sea and the Gulf of Oman in the south and is bordered by India to the east, Afghanistan to the west, Iran to the southwest and China in the far northeast respectively. It is separated from Tajikistan by Afghanistan's narrow Wakhan Corridor in the north, and also shares a maritime border with Oman.  - Zamir Jaffri Cricket Stadium is a cricket stadium in Jhelum , Pakistan . It is named after Jhelumi poet Syed Zamir Jafri . It was a local district - level stadium , but now the Pakistan Cricket Board has upraised it for regional level events . Six extra cricket pitches have been constructed .  - The Pakistan Cricket Board is a sporting organization that is responsible for governing all professional cricket, including Test cricket and One Day International matches played in Pakistan. It controls and organises all tours and matches undertaken by the Pakistan national cricket team.    What entity does 'zamir jaffri cricket stadium' has the relation 'occupant' with?
Answer:"
You are an AI assistant. User will you give you a task. Your goal is to complete the task as faithfully as you can. While performing the task think step-by-step and justify your steps.,"Write an article based on this summary:

Scotland recorded their first win of the ICC Women's World Cup Qualifier tournament with a seven-run victory over Papua New Guinea.

Article:"
You are an AI assistant. User will you give you a task. Your goal is to complete the task as faithfully as you can. While performing the task think step-by-step and justify your steps.,"Australian rules football and cricket are the most popular sports in Melbourne. It is considered the spiritual home of the two sports in Australia. The first official Test cricket match was played at the Melbourne Cricket Ground in March 1877. The origins of Australian rules football can be traced to matches played next to the MCG in 1858. The Australian Football League is headquartered at Docklands Stadium. Nine of the League's teams are based in the Melbourne metropolitan area: Carlton, Collingwood, Essendon, Hawthorn, Melbourne, North Melbourne, Richmond, St Kilda, and Western Bulldogs. Up to five AFL matches are played each week in Melbourne, attracting an average 40,000 people per game. Additionally, the city annually hosts the AFL Grand Final.
What are the two most popular sports in Melbourne?"
,"Given the question: This article: The NSWCA appealed to Lord Harris, and in reply he said he did not blame them or the cricketers of Sydney in any way, but said that ""it [the riot] was an occurrence it was impossible he could forget"". On 11 February, one day after the conclusion of the match and three days after the riot, Harris wrote a letter to one of his friends about the disturbance. It was clear that he intended the letter to be printed in the press, and it appeared in full in The Daily Telegraph on 1 April, among other London newspapers, reigniting the furore. Wisden Cricketers' Almanack considered the incident of such significance that it reprinted the whole correspondence. The letter gives a detailed contemporary account of what Lord Harris thought about the riot.Lord Harris referred to the crowd as a ""howling mob"" and said ""I have seen no reason as yet to change my opinion of Coulthard's qualities, or to regret his engagement, in which opinion I am joined by the whole team"". He further added that ""Beyond slyly kicking me once or twice the mob behaved very well, their one cry being, 'Change your umpire'. And now for the cause of this disturbance, not unexpected, I may say, by us, for we have heard accounts of former matches played by English teams."" Harris further accused a New South Wales parliamentarian of assisting the gamblers in the inciting the unrest, although he did not name the accusee. He said I blame the NSW Eleven for not objecting to Coulthard before the match began, if they had reason to suppose him incompetent to fulfil his duties. I blame the members of the association (many, of course, must be excepted) for their discourtesy and uncricket like behaviour to their guests; and I blame the committee and others of the association for ever permitting betting, but this last does not, of course, apply to our match only. I am bound to say they did all in their power to quell the disturbance. I don't think anything would have happened if A. Bannerman had been run out instead of Murdoch, but the latter, besides being a great... contains an answer for the question: Who did Harris accuse of assisting the gamblers in the inciting the unrest,?, what is it ?
The answer is:"
You are an AI assistant. You will be given a task. You must generate a detailed and long answer.,"Use the following highlights to write an article:

Australian leg-spinner Stuart MacGill has announced he will quit Test cricket. The 37-year-old made his Test debut 10 years ago and has taken 207 wickets. MacGill took only wicket to fall in rain-interrupted third day of second Test. Shivnarine Chanderpaul and Dwayne Bravo compile unbroken stand of 73.

Article:"
,"Detailed Instructions: In this task, you will be presented with a text and a pronoun. You should write the name that the pronoun refers to. Position of the pronoun in the text is showed within two ""_""s.
 and Syed Rasel and Talha Jubair also chipped in, as Gloucestershire imploded to 72 for 7. However, 83 from wicketkeeper Stephen Snell lifted them to 232, before Jon Lewis and James Averis dug into the tourists to reduce them to 29 for 3. However, Tushar Imran played his way to _his_ fourth first-class century, a career-best 119, to give the tourists a slender lead of 19 after a 122-run fourth-wicket stand between Tushar and Alok Kapali. <sep>, Pronoun: his
A:"
You are an AI assistant. You will be given a task. You must generate a detailed and long answer.,"Attributes: name = The Cricketers, eatType = coffee shop, food = Italian, customer rating = high, familyFriendly = yes, near = The Portland Arms. Produce a detailed sentence about this restaurant."
You are an AI assistant that follows instruction extremely well. Help as much as you can.,"Please answer the following question: Facts:   - deliveries: balls - 106    - source: http://content-aus.cricinfo.com/india/content/player/26896.html    - columns: 2    - matches: - 2    - s/s: - / - - / -    - fivefor: - -    - country: india    - column: tests odis    - bowling: right-arm fast-medium    - batting: right-hand bat    - runs: - -    - wickets: - 5    - name: amit bhandari    - catches/stumpings: - / - - / -    - year: 2007      - date: 21 april    - tenfor: - n/a   Based on these bullet points, write a short biography describing the life of amit bhandari .
A:"
You are an AI assistant. User will you give you a task. Your goal is to complete the task as faithfully as you can. While performing the task think step-by-step and justify your steps.,"Create a set of triples that describes the content in the following sentence.

The Cricketers is a coffee shop near The Portland Arms which provides French food. It is children friendly and it has a customer rating of 5 out of 5.

"
You are an AI assistant. You will be given a task. You must generate a detailed and long answer.,"Concepts: cricketer, moment, share

Write a sentence that includes all these words."
You are an AI assistant. User will you give you a task. Your goal is to complete the task as faithfully as you can. While performing the task think step-by-step and justify your steps.,"Can we draw the following hypothesis from the context (see options)? 

Context:

 an English limited overs county cricket tournament. It was held between 29 June and 3 September 1977. The tournament was won by Middlesex County Cricket Club who defeated Glamorgan County Cricket Club by 5 wickets in the final at Lord's.

Hypothesis: Glamorgan Country Cricket Club lost by 5 wickets in 1977 in the championship.
Choose from:
[1]. Yes
[2]. It's impossible to say
[3]. No"
"You are a helpful assistant, who always provide explanation. Think like you are answering to a five year old.","Attributes: name = The Cricketers, eatType = pub, customer rating = 5 out of 5, familyFriendly = yes, near = Ranch. Produce a detailed sentence about this restaurant."
You are an AI assistant. User will you give you a task. Your goal is to complete the task as faithfully as you can. While performing the task think step-by-step and justify your steps.,"Given the question: Information:  - Tender Mercies is a 1983 American drama film directed by Bruce Beresford. The screenplay by Horton Foote focuses on Mac Sledge, a recovering alcoholic country music singer who seeks to turn his life around through his relationship with a young widow and her son in rural Texas. Robert Duvall plays the role of Mac; the supporting cast includes Tess Harper, Betty Buckley, Wilford Brimley, Ellen Barkin and Allan Hubbard.  - The Cannes Festival (French: Festival de Cannes), named until 2002 as the International Film Festival (""Festival international du film"") and known in English as the Cannes Film Festival, is an annual film festival held in Cannes, France, which previews new films of all genres, including documentaries, from all around the world. Founded in 1946, the invitation-only festival is held annually (usually in May) at the Palais des Festivals et des Congrès.  - Do the Right Thing is a 1989 American comedy-drama film produced, written, and directed by Spike Lee, who also played the part of Mookie in the film. Other members of the cast include Danny Aiello, Ossie Davis, Ruby Dee, Richard Edson, Giancarlo Esposito, Bill Nunn, John Turturro, and Samuel L. Jackson. It is also notably the feature film debut of both Martin Lawrence and Rosie Perez. The movie tells the story of a Brooklyn neighborhood's simmering racial tension, which comes to a head and culminates in tragedy on the hottest day of summer.  - Mac is a 1992 American drama film co-written and directed by John Turturro , in his directorial debut . It stars Turturro alongside Michael Badalucco , Katherine Borowitz , Carl Capotorto , Nicholas Turturro and Ellen Barkin . It won the Caméra d'Or award at the 1992 Cannes Film Festival and was nominated for an Independent Spirit Award .  - The Sopranos is an American crime drama television series created by David Chase. Revolving around the fictional character and family of New Jersey-based Italian American mobster Tony Soprano (James Gandolfini), the show portrays the difficulties he faces as he tries to balance the conflicting requirements of his home life and his criminal organization. These are often highlighted during his therapy sessions with psychiatrist Jennifer Melfi (Lorraine Bracco). The series features Tony's family members, mafia colleagues and rivals, in prominent roles and story arcs, most notably his wife Carmela (Edie Falco) and protégé Christopher Moltisanti (Michael Imperioli).  - The Palme d'Or is the highest prize awarded at the Cannes Film Festival. It was introduced in 1955 by the organising committee. From 1939 to 1954, the highest prize was the ""Grand Prix du Festival International du Film"".   - Bille August (born 9 November 1948) is a Danish Academy Award-winning film and television director. His film ""Pelle the Conqueror"" from 1987 won the Palme d'Or, Academy Award and Golden Globe. He is one of only eight directors to win the Palme d'Or twice, winning the prestigious award again in 1992 for ""The Best Intentions"", based on the autobiographical script by Ingmar Bergman. He was married to Swedish actress Pernilla August from 1991 to 1997. His son Anders August is a screenwriter.  - The Directors' Fortnight is an independent section held in parallel to the Cannes Film Festival. It was started in 1969 by the French Directors Guild after the events of May 1968 resulted in cancellation of the Cannes festival as an act of solidarity with striking workers.  - Barton Fink is a 1991 American period film written, produced, directed and edited by the Coen brothers. Set in 1941, it stars John Turturro in the title role as a young New York City playwright who is hired to write scripts for a film studio in Hollywood, and John Goodman as Charlie, the insurance salesman who lives next door at the run-down Hotel Earle.  - The Practice is an American legal drama created by David E. Kelley centering on the partners and associates at a Boston law firm. Running for eight seasons on ABC from 1997 to 2004, the show won the Emmy in 1998 and 1999 for Best Drama Series, and spawned the spin-off series ""Boston Legal"", which ran for five more seasons, from 2004 to 2008.  - John Michael Turturro (born February 28, 1957) is an Italian-American actor, writer and filmmaker known for his roles in the films ""Do the Right Thing"" (1989), ""Miller's Crossing"" (1990), ""Barton Fink"" (1991), ""Quiz Show"" (1994), ""The Big Lebowski"" (1998), ""O Brother, Where Art Thou?"" (2000) and the first three films in the ""Transformers"" film series (20072011), a role which he will be reprising for (2017). He has appeared in over sixty films and has worked frequently with the Coen brothers, Adam Sandler and Spike Lee.  - Michael Badalucco (born December 20, 1954) is an American actor, best known for his role as lawyer Jimmy Berlutti on the ABC legal drama television series ""The Practice"". In 1999, he won the Primetime Emmy Award for Outstanding Supporting Actor in a Drama Series for performance in the role.  - The Caméra d'Or (""Golden Camera"") is an award of the Cannes Film Festival for the best first feature film presented in one of the Cannes' selections (Official Selection, Directors' Fortnight or International Critics' Week). The prize, created in 1978 by Gilles Jacob, is awarded during the Festival's Closing Ceremony by an independent jury.  - The 45th Cannes Film Festival was held on 718 May 1992. The Palme d'Or went to the ""Den goda viljan"" by Bille August.  - Nicholas Turturro, Jr. (born January 29, 1962) is an American film, television and prolific on-stage character actor, known for his role as Detective James Martinez on the television series ""NYPD Blue"".  - Ellen Rona Barkin (born April 16, 1954) is an American actress and film producer. Her breakthrough role was in the 1982 comedy-drama film ""Diner"", and the following years she had starring roles in films include ""Tender Mercies"" (1983), ""The Adventures of Buckaroo Banzai Across the 8th Dimension"" (1984), and ""The Big Easy"" (1987).  - Adam Richard Sandler (born September 9, 1966) is an American actor, comedian, screenwriter, film producer, and musician. After becoming a ""Saturday Night Live"" cast member, Sandler went on to star in many Hollywood feature films that combined have grossed over $2 billion at the box office. He is best known for his comedic roles, such as in the films ""Billy Madison"" (1995), the sports comedies ""Happy Gilmore"" (1996) and ""The Waterboy"" (1998), the romantic comedy ""The Wedding Singer"" (1998), ""Big Daddy"" (1999), and ""Mr. Deeds"" (2002), and voicing Dracula in ""Hotel Transylvania"" (2012) and ""Hotel Transylvania 2"" (2015). He has ventured into more dramatic territory with his roles in ""Punch-Drunk Love"" (2002), ""Spanglish"" (2004), ""Reign Over Me"" (2007), and ""Funny People"" (2009).  - The Big Lebowski is a 1998 American crime comedy film written, produced, and directed by Joel and Ethan Coen. It stars Jeff Bridges as Jeffrey ""The Dude"" Lebowski, a Los Angeles slacker and avid bowler. He is assaulted as a result of mistaken identity, after which The Dude learns that a millionaire also named Jeffrey Lebowski was the intended victim. The millionaire Lebowski's trophy wife is kidnapped, and he commissions The Dude to deliver the ransom to secure her release; but the plan goes awry when the Dude's friend Walter Sobchak (John Goodman) schemes to keep the ransom money. Julianne Moore and Steve Buscemi also star, with David Huddleston, John Turturro, Philip Seymour Hoffman, Sam Elliott, Tara Reid, David Thewlis and Flea appearing in supporting roles.  - NYPD Blue is an American police procedural drama television series set in New York City, exploring the struggles of the fictional 15th Precinct detective squad in Manhattan. Each episode typically intertwines several plots involving an ensemble cast.  - Joel David Coen (born November 29, 1954) and Ethan Jesse Coen (born September 21, 1957), collectively referred to as the Coen brothers, are American filmmakers. Their films span many genres and styles, which they frequently subvert or parody. Their best-reviewed works include ""Fargo"" (1996), ""The Big Lebowski"" (1998), ""No Country for Old Men"" (2007), ""A Serious Man"" (2009), ""True Grit"" (2010), and ""Inside Llewyn Davis"" (2013).  - Carl Capotorto (born January 16, 1959) is an American actor, known for his portrayal of Little Paulie Germani on ""The Sopranos"". He is also the author of ""Twisted Head: An Italian-American Memoir"".  - The International Critics' Week, founded in 1962 and organized by the French Syndicate of Cinema Critics. It was created following the showing of ""The Connection"" directed by Shirley Clarke which had been organized by the French Syndicate of Cinema Critics for the 1961 Cannes Film Festival.    Given the information above, choose from the list below the object entity that exhibits the relation 'narrative location' with the subject 'mac '.  Choices: - 1991  - 1992  - 2013  - boston  - brooklyn  - cannes  - hollywood  - los angeles  - new jersey  - new york  - new york city  - police  - texas
The answer is:"
