system_prompt,question
"You are a helpful assistant, who always provide explanation. Think like you are answering to a five year old.","Here is a news article: LONDON (Reuters) - A French man who was running late for his flight from London to Los Angeles tried to delay it by calling police to say there was a bomb on board. 
  
 who lives in east London, made the call eight minutes before his 5.47 a.m. Norwegian Air flight from Gatwick Airport was due to leave on May 11 because he was significantly late and airline staff had refused to allow him on board, a court heard. 
  
 His hoax meant passengers had to be re-screened and take-off was delayed by 90 minutes. An investigation by Gatwick revealed that the hoax call had been made using the same number linked to his booking. 
  
 he was arrested. 
  
 He initially claimed he had lost his phone’s SIM card but on Tuesday pleaded guilty at Lewes Crown Court to communicating false information regarding a noxious substance likely to create serious risk to human health. He was sentenced to 10 months in prison. 
  
 who fabricated an extremely serious allegation purely for his own benefit,” said Gatwick Police Chief Inspector Marc Clothier on Thursday. 
  
 however this turned out to be the worst decision he could have made.” ||||| An airline passenger made an anonymous hoax bomb threat to delay his flight because he was running late. 
  
 Librarian Jacob Meir Abdellak called police at 5.46am on 11 May - just eight minutes before the plane was due to set off from London's Gatwick Airport to Los Angeles in the US. 
  
 Officials were forced to postpone take-off for 90 minutes to carry out a full security screening. 
  
 Abdellak arrived ""significantly late"" and became abusive when he was prevented from boarding by airline staff and told to rearrange his trip for another date. 
  
 The Frenchman was arrested when he returned eleven days later on 22 May to catch another flight to the US. 
  
 Investigators had discovered the phone number used to make the bomb threat was the same one used to make the flight booking with Norwegian Airlines. 
  
 He admitted it was his number but claimed he had lost the SIM card a few days before the hoax call was made. 
  
 of Amhurst Park, Hackney, was charged with communicating false information regarding a noxious substance likely to create serious risk to human health. 
  
 when he changed his plea to guilty. 
  
 Abdellak was jailed for 10 months and ordered to pay a £140 victim surcharge. 
  
 Omagh, for the ceremony to mark the 20th anniversary of the Omagh bombing on 15 August 1998. The worst single atrocity of the Northern Ireland conflict killed 29, including a woman pregnant with twins PA 3/50 14 August 2018 Police arrest a man after he crashed a car into security barriers outside the Houses of Parliament Sky News 4/50 13 August 2018 Communities Secretary James Brokenshire today launched a £100 million pound government fund to end rough sleeping in England within the next decade. Brokenshire is pictured here at the central London headquarters for homelessness charity the Passage, where he launched the scheme PA 5/50 12 August 2018 Police officers stand guard at the scene of a shooting at Claremont Road in the Moss Side neighborhood of Manchester, Ten people were taken to hospital on August 12, 2018 after shots were fired in Manchester in northern England, police said. AFP/Getty 6/50 11 August 2018 Great Britain's Dina Asher-Smith reacts after she won gold in the women's 200m final at the European Athletics Championships in Berlin, completing the sprint double after she won the 100m just days before Getty/European Athletics 7/50 10 August 2018 Pedestrians walk past the entrance of the retail store House of Fraser in central London. The Chinese-owned UK department store chain, entered administration on August 10 only to be swiftly snapped up by retailer Sports Direct for £90 million ($115 million, 100 million euros) AFP/Getty 8/50 9 August 2018 Local people protest outside the Hillingdon Conservative Association office on August 9, 2018 in Uxbridge, England. Today's protest is being held following comments made by former Foreign Secretary, Boris Johnson, against the wearing of Burkas by Muslim women in the United Kingdom. An independent panel will investigate complaints made regarding Mr Johnson's comments and possible breaches of the Conservative Party code of conduct. Getty 9/50 8 August 2018 Britain's Prince William, right, and Britain's Prime Minister Theresa May, walk past a German flag, left, and a Britain's flag as they leave the Amiens cathedral, northern France. Prince William and Theresa May are marking the somber centenary of the Battle of Amiens, in France, a short, bloody and decisive battle that heralded the end of World War I AP 10/50 7 August 2018 Great Britain's Jack Laugher and James Heatly pose with their Gold and Bronze medal's respectively won in the 1 metre springboard men's final at the European Diving Championships in Glasgow EPA 11/50 6 August 2018 England cricketer Ben Stokes arrives at Bristol Crown Court accused of affray. The 27-year-old all-rounder and two other men, Ryan Ali and Ryan Hale are jointly charged with affray in the Clifton Triangle area of Bristol on September 25 last year, several hours after England had played a one-day international against the West Indies in the city PA 12/50 5 August 2018 Great Britain's Laura Kenny celebrates after winning the Women's Elimination Race final at the European Championships in Glasgow 13/50 4 August 2018 Ben Stokes celebrates taking the wicket of India's Hardik Pandya with team mates during the first test at Edgbaston Action Images via Reuters 14/50 3 August 2018 French President Emmanuel Macron waves to people as he arrives at the Fort de Bregancon for a meeting with British Prime Minister Theresa May epa 15/50 2 August 2018 Brexit Minister Dominic Raab is welcomed by French Minister attached to the Foreign Affairs Minister Nathalie Loiseau prior to a meeting in Paris AFP/Getty 16/50 1 August 2018 Demonstrators against Tommy Robinson outside the Royal Courts of Justice in London, where the former English Defence League leader has been freed on bail by the Court of Appeal after winning a challenge against a finding of contempt of court PA 17/50 31 July 2018 Friends of Lucy McHugh gather in Mansel Park, Southampton to release balloons in her memory. Lucy disappeared from her Southampton home last Wednesday and her body was later found in woodland near Southampton Sports Centre at 7.45am on Thursday PA 18/50 30 July 2018 Foreign Secretary Jeremy Hunt followed in the footsteps of his gaffe-prone predecessor Boris Johnson as he mistakenly referred to his Chinese wife as Japanese whilst on his first diplomatic mission to China AP 19/50 29 July 2018 Britain's Geraint Thomas, left, wearing the overall leader's yellow jersey and Britain's Luke Rowe hold the flag of Wales during the 21st and last stage of the 105th edition of the Tour de France cycling race between Houilles and Paris Champs-Elysees. Thomas is the first Welshman to win the Tour de France AP 20/50 28 July 2018 Passengers wait and queue following flight disruption at London Stansted Airport. The British National Air Traffic Services (Nats) placed temporary restrictions during the adverse weather on 27 July leading to flight cancellations and delays across Britain EPA 21/50 27 July 2018 The scene on the A96 between Huntly and Keith in Moray where a five people have died and five more were injured after a crash between a minibus and a car. PA 22/50 26 July 2018 Anti-Brexit campaigners parked a removal van outside the Foreign Secretary's official home in central London in protest of former Foreign Secretary Boris Johnson's continued residence there PA 23/50 25 July 2018 Labour leader Jeremy Corbyn during his visit to HS2 trains bidder Bombardier in Derby, following the launch of the party's new Build it in Britain campaign PA 24/50 24 July 2018 Great Britain's Geraint Thomas cleans his eyes after tear gas was thrown at the pelaton during a farmers' protest who attempted to block the stage's route, during the 16th stage of the Tour de France, between Carcassonne and Bagneres-de-Luchon. The race was halted for several minutes. AFP/Getty Images 25/50 23 July 2018 Crime scene investigators at the scene near the Hilton Hotel, Deansgate, Manchester where a woman with serious injuries to her neck was found in the morning. Six people have been arrested on suspicion of attempted murder after the woman was attacked inside the hotel PA 26/50 22 July 2018 Italy's Francesco Molinari kisses the trophy after winning the 147th Open golf Championship at Carnoustie, Scotland AFP/Getty 27/50 21 July 2018 Great Britain's Tom Bosworth poses after winning the men's 3000m race walk with a new World Record time at the IAAF Diamond League athletics anniversary games meeting in London EPA 28/50 20 July 2018 British Prime Minister Theresa May delivers a keynote speech at the Waterfront Hall in Belfast. The Prime Minister is on a two-day visit to Northern Ireland. During her visit, focusing on Brexit and the deadlock at Stormont, she will visit the Irish border and discuss the potential impact of Brexit with Northern Irish businesses Getty 29/50 19 July 2018 Britain's newly appointed chief Brexit negotiator Dominic Raab, left, and EU's chief Brexit negotiator Michel Barnier speak to the media ahead of a meeting at the European Commission in Brussels. Britain's chief Brexit negotiator David Davis resigned less than two weeks ago and his successor Raab met his EU counterpart Michel Barnier for the first time late Thursday. AP 30/50 18 July 2018 An emotional Sir Cliff Richard with his legal team outside the High Court in London after he was awarded £210,000 in damages in his privacy battle against the BBC over their coverage of a police raid of his home EPA 31/50 17 July 2018 Pro-EU demonstrators wave flags outside the Houses of Parliament in Westminster. Reuters 32/50 16 July 2018 Theresa May arives to open the Farnborough Airshow Getty 33/50 15 July 2018 Novak Djokovic lifts the trophy after winning the men's singles final match against Kevin Anderson at Wimbledon AP 34/50 14 July 2018 Far-right protesters demanding the release of jailed EDL founder Tommy Robinson brought chaos to central London after blockading a bus being driven by a woman in a headscarf during the march The Independent 35/50 13 July 2018 US President Donald Trump and British Prime Minister Theresa during their meeting at Chequers in Buckinghamshire Reuters 36/50 12 July 2018 US President Donald Trump and first lady Melania Trump arrive in the UK Reuters 37/50 11 July 2018 England manager Gareth Southgate and his players look dejected after they lost their World Cup semi final match against Croatia at Luzhniki Stadium in Moscow Getty 38/50 10 July 2018 Serena Williams celebrates after winning against Camila Giorgi during their women's singles quarter-final match on the eighth day of Wimbledon. Williams won the match 3-6, 6-3, 6-4 Getty 39/50 9 July 2018 Britain's new Secretary of State for Exiting the European Union Dominic Raab leaves 10 Downing Street after it was announced he was appointed to the job. The former Housing Minister is to take up the post, after UK Brexit Secretary David Davis resigned from the Cabinet and said Monday that he won't seek to challenge Prime Minister Theresa May's leadership AP 40/50 8 July 2018 Ferrari's Sebastian Vettel celebrates winning the British Grand Prix in front of second place finisher Lewis Hamilton at Silverstone Getty 41/50 7 July 2018 Gareth Southgate, manager of England, celebrates at the final whistle following his side's quarter final victory over Sweden at the World Cup in Russia Getty 42/50 6 July 2018 Forensic investigators wearing protective suits enter the rear of John Baker House, a supported housing scheme for the homeless in Salisbury after it was evacuated the previous day. Police are investigating the scene after a man and woman were exposed to nerve agent novichok and are in critical condition Reuters 43/50 5 July 2018 German Chancellor Angela Merkel receives Britain's Prime Minister Theresa May in Berlin Reuters 44/50 4 July 2018 British police officers stand facing a residential property in Amesbury. British police have declared a ""major incident"" after two people were exposed to an unknown substance in the town, and are cordoning off places the people are known to have visited before falling ill AP 45/50 3 July 2018 England celebrate after beating Colombia on penalties in their round of 16 match at the World Cup in the Spartak Stadium, in Moscow AP 46/50 2 July 2018 Floral tributes left at Gorleston beach in Norfolk where a girl was fatally thrown from an inflatable on Sunday, as an MP calls for bouncy castles to be temporarily banned in public areas PA 47/50 1 July 2018 A firefighter carries a water hose past sheep close to scorched moorland as it burns during a fire at Winter Hill, near Rivington Reuters 48/50 30 June 2018 People march in central London to mark the 70th anniversary of the NHS PA 49/50 29 June 2018 People look at the damage to the outside of a high-rise block in Wellington Way, Mile End, in east London, after a fire broke-out in a 12th floor flat PA 50/50 28 June 2018 Prime Minister Theresa May holds up a Belgium football shirt given to her by Belgian Prime Minister Charles Michel, center left, during a round table meeting at an EU summit in Brussels. European Union leaders meet for a two-day summit to address the political crisis over migration and discuss how to proceed on the Brexit negotiations AP 1/50 16 August 2018 Students react as they receive their 'A' level results at Stoke Newington School and Sixth Form in London. Universities accepted thousands fewer students as pass rates hit lowest level since 2010 Reuters 2/50 15 August 2018 People gather on Market Street, Omagh, for the ceremony to mark the 20th anniversary of the Omagh bombing on 15 August 1998. The worst single atrocity of the Northern Ireland conflict killed 29, including a woman pregnant with twins PA 3/50 14 August 2018 Police arrest a man after he crashed a car into security barriers outside the Houses of Parliament Sky News 4/50 13 August 2018 Communities Secretary James Brokenshire today launched a £100 million pound government fund to end rough sleeping in England within the next decade. Brokenshire is pictured here at the central London headquarters for homelessness charity the Passage, where he launched the scheme PA 5/50 12 August 2018 Police officers stand guard at the scene of a shooting at Claremont Road in the Moss Side neighborhood of Manchester, Ten people were taken to hospital on August 12, 2018 after shots were fired in Manchester in northern England, police said. AFP/Getty 6/50 11 August 2018 Great Britain's Dina Asher-Smith reacts after she won gold in the women's 200m final at the European Athletics Championships in Berlin, completing the sprint double after she won the 100m just days before Getty/European Athletics 7/50 10 August 2018 Pedestrians walk past the entrance of the retail store House of Fraser in central London. The Chinese-owned UK department store chain, entered administration on August 10 only to be swiftly snapped up by retailer Sports Direct for £90 million ($115 million, 100 million euros) AFP/Getty 8/50 9 August 2018 Local people protest outside the Hillingdon Conservative Association office on August 9, 2018 in Uxbridge, England. Today's protest is being held following comments made by former Foreign Secretary, Boris Johnson, against the wearing of Burkas by Muslim women in the United Kingdom. An independent panel will investigate complaints made regarding Mr Johnson's comments and possible breaches of the Conservative Party code of conduct. Getty 9/50 8 August 2018 Britain's Prince William, right, and Britain's Prime Minister Theresa May, walk past a German flag, left, and a Britain's flag as they leave the Amiens cathedral, northern France. Prince William and Theresa May are marking the somber centenary of the Battle of Amiens, in France, a short, bloody and decisive battle that heralded the end of World War I AP 10/50 7 August 2018 Great Britain's Jack Laugher and James Heatly pose with their Gold and Bronze medal's respectively won in the 1 metre springboard men's final at the European Diving Championships in Glasgow EPA 11/50 6 August 2018 England cricketer Ben Stokes arrives at Bristol Crown Court accused of affray. The 27-year-old all-rounder and two other men, Ryan Ali and Ryan Hale are jointly charged with affray in the Clifton Triangle area of Bristol on September 25 last year, several hours after England had played a one-day international against the West Indies in the city PA 12/50 5 August 2018 Great Britain's Laura Kenny celebrates after winning the Women's Elimination Race final at the European Championships in Glasgow 13/50 4 August 2018 Ben Stokes celebrates taking the wicket of India's Hardik Pandya with team mates during the first test at Edgbaston Action Images via Reuters 14/50 3 August 2018 French President Emmanuel Macron waves to people as he arrives at the Fort de Bregancon for a meeting with British Prime Minister Theresa May epa 15/50 2 August 2018 Brexit Minister Dominic Raab is welcomed by French Minister attached to the Foreign Affairs Minister Nathalie Loiseau prior to a meeting in Paris AFP/Getty 16/50 1 August 2018 Demonstrators against Tommy Robinson outside the Royal Courts of Justice in London, where the former English Defence League leader has been freed on bail by the Court of Appeal after winning a challenge against a finding of contempt of court PA 17/50 31 July 2018 Friends of Lucy McHugh gather in Mansel Park, Southampton to release balloons in her memory. Lucy disappeared from her Southampton home last Wednesday and her body was later found in woodland near Southampton Sports Centre at 7.45am on Thursday PA 18/50 30 July 2018 Foreign Secretary Jeremy Hunt followed in the footsteps of his gaffe-prone predecessor Boris Johnson as he mistakenly referred to his Chinese wife as Japanese whilst on his first diplomatic mission to China AP 19/50 29 July 2018 Britain's Geraint Thomas, left, wearing the overall leader's yellow jersey and Britain's Luke Rowe hold the flag of Wales during the 21st and last stage of the 105th edition of the Tour de France cycling race between Houilles and Paris Champs-Elysees. Thomas is the first Welshman to win the Tour de France AP 20/50 28 July 2018 Passengers wait and queue following flight disruption at London Stansted Airport. The British National Air Traffic Services (Nats) placed temporary restrictions during the adverse weather on 27 July leading to flight cancellations and delays across Britain EPA 21/50 27 July 2018 The scene on the A96 between Huntly and Keith in Moray where a five people have died and five more were injured after a crash between a minibus and a car. PA 22/50 26 July 2018 Anti-Brexit campaigners parked a removal van outside the Foreign Secretary's official home in central London in protest of former Foreign Secretary Boris Johnson's continued residence there PA 23/50 25 July 2018 Labour leader Jeremy Corbyn during his visit to HS2 trains bidder Bombardier in Derby, following the launch of the party's new Build it in Britain campaign PA 24/50 24 July 2018 Great Britain's Geraint Thomas cleans his eyes after tear gas was thrown at the pelaton during a farmers' protest who attempted to block the stage's route, during the 16th stage of the Tour de France, between Carcassonne and Bagneres-de-Luchon. The race was halted for several minutes. AFP/Getty Images 25/50 23 July 2018 Crime scene investigators at the scene near the Hilton Hotel, Deansgate, Manchester where a woman with serious injuries to her neck was found in the morning. Six people have been arrested on suspicion of attempted murder after the woman was attacked inside the hotel PA 26/50 22 July 2018 Italy's Francesco Molinari kisses the trophy after winning the 147th Open golf Championship at Carnoustie, Scotland AFP/Getty 27/50 21 July 2018 Great Britain's Tom Bosworth poses after winning the men's 3000m race walk with a new World Record time at the IAAF Diamond League athletics anniversary games meeting in London EPA 28/50 20 July 2018 British Prime Minister Theresa May delivers a keynote speech at the Waterfront Hall in Belfast. The Prime Minister is on a two-day visit to Northern Ireland. During her visit, focusing on Brexit and the deadlock at Stormont, she will visit the Irish border and discuss the potential impact of Brexit with Northern Irish businesses Getty 29/50 19 July 2018 Britain's newly appointed chief Brexit negotiator Dominic Raab, left, and EU's chief Brexit negotiator Michel Barnier speak to the media ahead of a meeting at the European Commission in Brussels. Britain's chief Brexit negotiator David Davis resigned less than two weeks ago and his successor Raab met his EU counterpart Michel Barnier for the first time late Thursday. AP 30/50 18 July 2018 An emotional Sir Cliff Richard with his legal team outside the High Court in London after he was awarded £210,000 in damages in his privacy battle against the BBC over their coverage of a police raid of his home EPA 31/50 17 July 2018 Pro-EU demonstrators wave flags outside the Houses of Parliament in Westminster. Reuters 32/50 16 July 2018 Theresa May arives to open the Farnborough Airshow Getty 33/50 15 July 2018 Novak Djokovic lifts the trophy after winning the men's singles final match against Kevin Anderson at Wimbledon AP 34/50 14 July 2018 Far-right protesters demanding the release of jailed EDL founder Tommy Robinson brought chaos to central London after blockading a bus being driven by a woman in a headscarf during the march The Independent 35/50 13 July 2018 US President Donald Trump and British Prime Minister Theresa during their meeting at Chequers in Buckinghamshire Reuters 36/50 12 July 2018 US President Donald Trump and first lady Melania Trump arrive in the UK Reuters 37/50 11 July 2018 England manager Gareth Southgate and his players look dejected after they lost their World Cup semi final match against Croatia at Luzhniki Stadium in Moscow Getty 38/50 10 July 2018 Serena Williams celebrates after winning against Camila Giorgi during their women's singles quarter-final match on the eighth day of Wimbledon. Williams won the match 3-6, 6-3, 6-4 Getty 39/50 9 July 2018 Britain's new Secretary of State for Exiting the European Union Dominic Raab leaves 10 Downing Street after it was announced he was appointed to the job. The former Housing Minister is to take up the post, after UK Brexit Secretary David Davis resigned from the Cabinet and said Monday that he won't seek to challenge Prime Minister Theresa May's leadership AP 40/50 8 July 2018 Ferrari's Sebastian Vettel celebrates winning the British Grand Prix in front of second place finisher Lewis Hamilton at Silverstone Getty 41/50 7 July 2018 Gareth Southgate, manager of England, celebrates at the final whistle following his side's quarter final victory over Sweden at the World Cup in Russia Getty 42/50 6 July 2018 Forensic investigators wearing protective suits enter the rear of John Baker House, a supported housing scheme for the homeless in Salisbury after it was evacuated the previous day. Police are investigating the scene after a man and woman were exposed to nerve agent novichok and are in critical condition Reuters 43/50 5 July 2018 German Chancellor Angela Merkel receives Britain's Prime Minister Theresa May in Berlin Reuters 44/50 4 July 2018 British police officers stand facing a residential property in Amesbury. British police have declared a ""major incident"" after two people were exposed to an unknown substance in the town, and are cordoning off places the people are known to have visited before falling ill AP 45/50 3 July 2018 England celebrate after beating Colombia on penalties in their round of 16 match at the World Cup in the Spartak Stadium, in Moscow AP 46/50 2 July 2018 Floral tributes left at Gorleston beach in Norfolk where a girl was fatally thrown from an inflatable on Sunday, as an MP calls for bouncy castles to be temporarily banned in public areas PA 47/50 1 July 2018 A firefighter carries a water hose past sheep close to scorched moorland as it burns during a fire at Winter Hill, near Rivington Reuters 48/50 30 June 2018 People march in central London to mark the 70th anniversary of the NHS PA 49/50 29 June 2018 People look at the damage to the outside of a high-rise block in Wellington Way, Mile End, in east London, after a fire broke-out in a 12th floor flat PA 50/50 28 June 2018 Prime Minister Theresa May holds up a Belgium football shirt given to her by Belgian Prime Minister Charles Michel, center left, during a round table meeting at an EU summit in Brussels. European Union leaders meet for a two-day summit to address the political crisis over migration and discuss how to proceed on the Brexit negotiations AP 
  
 who fabricated an extremely serious allegation purely for his own benefit. 
  
 however this turned out to be the worst decision he could have made. 
  
 and also caused a level of fear and distress among a number of staff and passengers on board that flight. 
  
 guns or similar at densely populated locations such as airports are well documented, and Abdellak’s sentence serves as a warning to others that this sort of behaviour will not be tolerated and offenders will be dealt with robustly.” 
  
 crew and aircraft at all times.” |||||
A summary of this is?"
